{
	"info": {
		"_postman_id": "3f04b812-5869-4c68-831f-ab4a4aaf78e2",
		"name": "Gesti칩n Zool칩gico",
		"schema": "https://schema.getpostman.com/json/collection/v2.1.0/collection.json",
		"_exporter_id": "17721570"
	},
	"item": [
		{
			"name": "Zona",
			"item": [
				{
					"name": "By Id",
					"request": {
						"auth": {
							"type": "bearer",
							"bearer": [
								{
									"key": "token",
									"value": "{{token}}",
									"type": "string"
								}
							]
						},
						"method": "GET",
						"header": [],
						"url": {
							"raw": "{{base_url}}/api/zonas/1",
							"host": [
								"{{base_url}}"
							],
							"path": [
								"api",
								"zonas",
								"1"
							]
						},
						"description": "# Documentaci칩n del Endpoint\n\n## Descripci칩n\n\nEste endpoint permite obtener informaci칩n sobre una zona espec칤fica en el sistema. Al realizar una solicitud GET a este endpoint, se devuelve un objeto JSON que contiene los detalles de la zona solicitada.\n\n## M칠todo HTTP\n\n`GET`\n\n## URL\n\n`{{base_url}}/api/zonas/1`\n\n## Formato del Cuerpo de la Solicitud\n\nNo se requiere cuerpo de solicitud para este endpoint.\n\n## Par치metros Necesarios\n\n- **ID de la zona**: En la URL, el n칰mero `1` representa el ID de la zona que se desea consultar. Este par치metro es obligatorio.\n    \n\n## Ejemplo de Solicitud\n\n``` http\nGET {{base_url}}/api/zonas/1\n\n ```\n\n## Ejemplo de Respuesta\n\n``` json\n{\n  \"id\": 0,\n  \"nombre\": \"\",\n  \"especies\": [\"\"],\n  \"nameAnimales\": [\"\"]\n}\n\n ```\n\n## Notas Relevantes sobre Seguridad y Manejo del Token JWT\n\n- Este endpoint puede requerir un token JWT para la autenticaci칩n. Aseg칰rese de incluir el token en los encabezados de la solicitud si es necesario.\n    \n- Authorization: Bearer {su_token_jwt}\n    \n\nAseg칰rese de manejar el token de manera segura y no compartirlo p칰blicamente."
					},
					"response": []
				},
				{
					"name": "All Zonas",
					"request": {
						"auth": {
							"type": "bearer",
							"bearer": [
								{
									"key": "token",
									"value": "{{token}}",
									"type": "string"
								}
							]
						},
						"method": "GET",
						"header": [],
						"url": {
							"raw": "{{base_url}}/api/zonas",
							"host": [
								"{{base_url}}"
							],
							"path": [
								"api",
								"zonas"
							]
						},
						"description": "## Descripci칩n del Endpoint\n\nEste endpoint permite obtener una lista de zonas junto con sus respectivas especies y nombres de animales asociados.\n\n### 1\\. **M칠todo HTTP**\n\n- **GET**\n    \n\n### 2\\. **URL**\n\n- `{{base_url}}/api/zonas`\n    \n\n### 3\\. **Formato del cuerpo de la solicitud**\n\n- Este endpoint no requiere un cuerpo de solicitud, ya que es un m칠todo GET.\n    \n\n### 4\\. **Par치metros necesarios**\n\n- No se requieren par치metros en la solicitud.\n    \n\n### 5\\. **Ejemplos de solicitud y respuesta**\n\n**Ejemplo de Solicitud:**\n\n``` http\nGET {{base_url}}/api/zonas\n\n ```\n\n**Ejemplo de Respuesta:**\n\n``` json\n[\n    {\n        \"id\": 0,\n        \"nombre\": \"\",\n        \"especies\": [\"\"],\n        \"nameAnimales\": [\"\"]\n    }\n]\n\n ```\n\n### 6\\. **Notas relevantes sobre seguridad**\n\n- Aseg칰rese de manejar el token JWT adecuadamente en la cabecera de autorizaci칩n para acceder a este endpoint. La falta de un token v치lido puede resultar en un error de autorizaci칩n."
					},
					"response": []
				},
				{
					"name": "Zona",
					"request": {
						"auth": {
							"type": "bearer",
							"bearer": [
								{
									"key": "token",
									"value": "{{token}}",
									"type": "string"
								}
							]
						},
						"method": "POST",
						"header": [],
						"body": {
							"mode": "raw",
							"raw": "{\r\n  \"nombre\": \"Zona de ranas\"\r\n}",
							"options": {
								"raw": {
									"language": "json"
								}
							}
						},
						"url": {
							"raw": "{{base_url}}/api/zonas",
							"host": [
								"{{base_url}}"
							],
							"path": [
								"api",
								"zonas"
							]
						},
						"description": "# Documentaci칩n del Endpoint: Crear Zona\n\n## M칠todo HTTP\n\n**POST**\n\n## URL\n\n`{{base_url}}/api/zonas`\n\n## Formato del Cuerpo de la Solicitud\n\nEl cuerpo de la solicitud debe estar estructurado en formato JSON y debe incluir el siguiente campo:\n\n- **nombre** (string, obligatorio): El nombre de la zona que se desea crear.\n    \n\n### Ejemplo de Cuerpo de Solicitud\n\n``` json\n{\n  \"nombre\": \"Zona de ranas\"\n}\n\n ```\n\n## Par치metros Necesarios\n\n- **nombre**: (obligatorio) El nombre de la nueva zona.\n    \n\n## Ejemplo de Respuesta\n\n### Respuesta Exitosa\n\n- **C칩digo de Estado**: 201\n    \n- {\"Mensaje\": \"Zona creada exitosamente.\"}\n    \n\n## Notas Relevantes sobre Seguridad\n\n- Authorization: Bearer {token}\n    \n- Mantenga el token seguro y no lo comparta p칰blicamente."
					},
					"response": []
				},
				{
					"name": "Zona",
					"request": {
						"auth": {
							"type": "bearer",
							"bearer": [
								{
									"key": "token",
									"value": "{{token}}",
									"type": "string"
								}
							]
						},
						"method": "PUT",
						"header": [],
						"body": {
							"mode": "raw",
							"raw": "{\r\n  \"nombre\": \"Zona de aves / aviario\"\r\n}",
							"options": {
								"raw": {
									"language": "json"
								}
							}
						},
						"url": {
							"raw": "{{base_url}}/api/zonas/1",
							"host": [
								"{{base_url}}"
							],
							"path": [
								"api",
								"zonas",
								"1"
							]
						},
						"description": "# Documentaci칩n del Endpoint\n\nEste endpoint permite actualizar la informaci칩n de una zona espec칤fica en el sistema.\n\n## M칠todo HTTP\n\n**PUT**\n\n## URL\n\n`{{base_url}}/api/zonas/1`\n\n## Formato del cuerpo de la solicitud\n\nEl cuerpo de la solicitud debe estar en formato JSON y debe contener el siguiente campo:\n\n- **nombre** (string): El nombre de la zona que se desea actualizar.\n    \n\n### Ejemplo de solicitud\n\n``` json\n{\n  \"nombre\": \"Zona de aves / aviario\"\n}\n\n ```\n\n## Ejemplo de respuesta\n\nLa respuesta de una solicitud exitosa tendr치 el siguiente formato:\n\n``` json\n{\n  \"Mensaje\": \"Zona actualizada exitosamente.\"\n}\n\n ```\n\n## Notas relevantes sobre seguridad\n\nSe requiere un token JWT en el encabezado de autorizaci칩n para acceder a este endpoint. Aseg칰rate de que el token sea v치lido y no haya expirado."
					},
					"response": []
				},
				{
					"name": "By Id",
					"request": {
						"auth": {
							"type": "bearer",
							"bearer": [
								{
									"key": "token",
									"value": "{{token}}",
									"type": "string"
								}
							]
						},
						"method": "DELETE",
						"header": [],
						"url": {
							"raw": "{{base_url}}/api/zonas/5",
							"host": [
								"{{base_url}}"
							],
							"path": [
								"api",
								"zonas",
								"5"
							]
						},
						"description": "# Documentaci칩n del Endpoint\n\nEste endpoint permite eliminar una zona espec칤fica identificada por su ID.\n\n## M칠todo HTTP\n\nDELETE\n\n## URL\n\n{{base_url}}/api/zonas/{id}\n\n## Par치metros de la Solicitud\n\n- **id** (integer): El identificador 칰nico de la zona que se desea eliminar.\n    \n\n## Ejemplo de Solicitud\n\n``` http\nDELETE {{base_url}}/api/zonas/5\n\n ```\n\n## Ejemplo de Respuesta\n\n``` json\n{\n  \"Mensaje\": \"Zona eliminada exitosamente.\"\n}\n\n ```\n\n## Notas Relevantes sobre Seguridad\n\nSe requiere un token JWT en el encabezado de autorizaci칩n para acceder a este endpoint. Aseg칰rate de que el token sea v치lido y no haya expirado."
					},
					"response": []
				}
			]
		},
		{
			"name": "Especie",
			"item": [
				{
					"name": "By Id",
					"request": {
						"auth": {
							"type": "bearer",
							"bearer": [
								{
									"key": "token",
									"value": "{{token}}",
									"type": "string"
								}
							]
						},
						"method": "GET",
						"header": [],
						"url": {
							"raw": "{{base_url}}/api/especies/1",
							"host": [
								"{{base_url}}"
							],
							"path": [
								"api",
								"especies",
								"1"
							]
						},
						"description": "# 游닂 Endpoint: Obtener Detalles de una Especie\n\nEste endpoint permite obtener la informaci칩n detallada de una especie espec칤fica identificada por su ID.\n\n## 游빐 M칠todo HTTP\n\n`GET`\n\n## 游깷 URL de Solicitud\n\n{{base_url}}/api/especies/1\n\n## 游댝 Par치metros de Ruta\n\n- `1`: ID de la especie que se desea consultar. En este caso, el ID es `1`.\n    \n\n## 游닋 Cuerpo de la Solicitud\n\nNo se requiere cuerpo para esta solicitud `GET`.\n\n---\n\n## 游닌 Respuesta\n\nLa respuesta ser치 en formato **JSON** e incluir치 los siguientes campos:\n\n- `id` (entero): El identificador 칰nico de la especie.\n    \n- `nombre` (cadena): El nombre de la especie.\n    \n- `zonaName` (cadena): El nombre de la zona a la que pertenece la especie.\n    \n- `nameAnimales` (arreglo): Una lista de nombres de animales asociados a la especie. Puede estar vac칤a si no hay animales registrados para esta especie.\n    \n\n### 游빍 Ejemplo de Respuesta\n\n``` json\n{\n    \"id\": 1,\n    \"nombre\": \"Guepardo amarillo\",\n    \"zonaName\": \"Zona de panteras\",\n    \"nameAnimales\": []\n}\n\n ```"
					},
					"response": []
				},
				{
					"name": "All Especies",
					"request": {
						"auth": {
							"type": "bearer",
							"bearer": [
								{
									"key": "token",
									"value": "{{token}}",
									"type": "string"
								}
							]
						},
						"method": "GET",
						"header": [],
						"url": {
							"raw": "{{base_url}}/api/especies",
							"host": [
								"{{base_url}}"
							],
							"path": [
								"api",
								"especies"
							]
						},
						"description": "# Documentaci칩n del Endpoint: Obtener Especies\n\nEste endpoint permite recuperar una lista de especies disponibles en el sistema.\n\n## M칠todo HTTP\n\n`GET`\n\n## URL\n\n`{{base_url}}/api/especies`\n\n## Formato del cuerpo de la solicitud\n\nNo se requiere cuerpo en la solicitud.\n\n## Par치metros necesarios\n\nNo se requieren par치metros en la solicitud.\n\n## Ejemplo de solicitud\n\n``` http\nGET {{base_url}}/api/especies\n\n ```\n\n## Ejemplo de respuesta\n\n``` json\n[\n    {\n        \"id\": 0,\n        \"nombre\": \"\",\n        \"zonaName\": \"\",\n        \"nameAnimales\": []\n    }\n]\n\n ```\n\n## Notas sobre seguridad\n\nEste endpoint no requiere autenticaci칩n. Sin embargo, se recomienda implementar el manejo de tokens JWT en otros endpoints que modifiquen datos para asegurar la integridad y seguridad de la informaci칩n."
					},
					"response": []
				},
				{
					"name": "Especie",
					"request": {
						"auth": {
							"type": "bearer",
							"bearer": [
								{
									"key": "token",
									"value": "{{token}}",
									"type": "string"
								}
							]
						},
						"method": "POST",
						"header": [],
						"body": {
							"mode": "raw",
							"raw": "{\r\n  \"nombre\": \"Rana verde\",\r\n  \"zonaName\": \"Zona de ranas\"\r\n}",
							"options": {
								"raw": {
									"language": "json"
								}
							}
						},
						"url": {
							"raw": "{{base_url}}/api/especies",
							"host": [
								"{{base_url}}"
							],
							"path": [
								"api",
								"especies"
							]
						},
						"description": "# Documentaci칩n del API para el Endpoint de Especies\n\n## M칠todo HTTP\n\n**POST**\n\n## URL\n\n`{{base_url}}/api/especies`\n\n## Formato del cuerpo de la solicitud\n\nEl cuerpo de la solicitud debe estar estructurado en formato JSON. Aseg칰rate de que el tipo de contenido de la solicitud sea `application/json`.\n\n## Par치metros necesarios\n\n- **nombre** (string): El nombre de la especie que se desea agregar.\n    \n- **zonaName** (string): El nombre de la zona donde se encuentra la especie.\n    \n\n## Ejemplo de solicitud\n\n``` json\n{\n  \"nombre\": \"Rana verde\",\n  \"zonaName\": \"Zona de ranas\"\n}\n\n ```\n\n## Ejemplo de respuesta\n\n``` json\n{\n    \"id\": 1,\n    \"nombre\": \"Rana verde\",\n    \"zonaName\": \"Zona de ranas\"\n}\n\n ```\n\n## Notas relevantes sobre seguridad y manejo del token JWT\n\nEs importante manejar el token JWT de manera segura."
					},
					"response": []
				},
				{
					"name": "Especie",
					"request": {
						"auth": {
							"type": "bearer",
							"bearer": [
								{
									"key": "token",
									"value": "{{token}}",
									"type": "string"
								}
							]
						},
						"method": "PUT",
						"header": [],
						"body": {
							"mode": "raw",
							"raw": "{\r\n    \"nombre\": \"Guepardo carbon\",\r\n    \"zonaName\": \"Zona de panteras\"\r\n}",
							"options": {
								"raw": {
									"language": "json"
								}
							}
						},
						"url": {
							"raw": "{{base_url}}/api/especies/2",
							"host": [
								"{{base_url}}"
							],
							"path": [
								"api",
								"especies",
								"2"
							]
						},
						"description": "# Documentaci칩n del Endpoint\n\n## M칠todo HTTP\n\n**PUT**\n\n## URL\n\n`{{base_url}}/api/especies/2`\n\n## Formato del cuerpo de la solicitud\n\nEl cuerpo de la solicitud debe estar en formato **JSON**.\n\n## Par치metros necesarios\n\n- **nombre** (string, requerido): El nombre de la especie.\n    \n- **zonaName** (string, requerido): El nombre de la zona asociada a la especie.\n    \n\n## Ejemplos de solicitud\n\n``` json\n{\n  \"nombre\": \"Guepardo carbon\",\n  \"zonaName\": \"Zona de panteras\"\n}\n\n ```\n\n## Ejemplos de respuesta\n\n### Respuesta exitosa\n\n``` json\n{\n    \"Mensaje\": \"Especie actualizada correctamente.\"\n}\n\n ```\n\n### Respuesta de error\n\n``` json\n{\n  \"error\": \"No se encontr칩 la especie con el ID proporcionado.\"\n}\n\n ```\n\n## Notas relevantes sobre seguridad\n\n- Este endpoint requiere un **token JWT** v치lido en el encabezado de autorizaci칩n para garantizar que solo los usuarios autenticados puedan realizar modificaciones.\n    \n- Aseg칰rese de manejar el token de manera segura y de no exponerlo en el cliente."
					},
					"response": []
				},
				{
					"name": "By Id",
					"request": {
						"auth": {
							"type": "bearer",
							"bearer": [
								{
									"key": "token",
									"value": "{{token}}",
									"type": "string"
								}
							]
						},
						"method": "DELETE",
						"header": [],
						"url": {
							"raw": "{{base_url}}/api/especies/2",
							"host": [
								"{{base_url}}"
							],
							"path": [
								"api",
								"especies",
								"2"
							]
						},
						"description": "# Documentaci칩n del Endpoint DELETE\n\nEste endpoint se utiliza para eliminar un recurso espec칤fico en el sistema, identificado por su ID.\n\n## M칠todo HTTP\n\n**DELETE**\n\n## URL\n\n`{{base_url}}/api/especies/2`\n\n## Formato del cuerpo de la solicitud\n\nNo se requiere cuerpo en la solicitud para este endpoint.\n\n## Par치metros necesarios\n\n- **ID**: El ID del recurso que se desea eliminar (en este caso, `2`).\n    \n\n## Ejemplos de solicitud\n\n``` http\nDELETE {{base_url}}/api/especies/2\n\n ```\n\n## Ejemplos de respuesta\n\n- **C칩digo de estado**: 200\n    \n- {\"Mensaje\": \"Especie eliminada correctamente.\"}\n    \n\n## Notas relevantes sobre seguridad\n\nEs importante manejar adecuadamente el token JWT en las solicitudes para garantizar la autenticaci칩n y autorizaci칩n del usuario. Aseg칰rese de incluir el token en el encabezado de la solicitud para acceder a este endpoint de manera segura."
					},
					"response": []
				}
			]
		},
		{
			"name": "Animal",
			"item": [
				{
					"name": "By Id",
					"request": {
						"auth": {
							"type": "bearer",
							"bearer": [
								{
									"key": "token",
									"value": "{{token}}",
									"type": "string"
								}
							]
						},
						"method": "GET",
						"header": [],
						"url": {
							"raw": "{{base_url}}/api/animales/1",
							"host": [
								"{{base_url}}"
							],
							"path": [
								"api",
								"animales",
								"1"
							]
						},
						"description": "# Documentaci칩n del Endpoint\n\nEste endpoint permite obtener informaci칩n sobre un animal espec칤fico utilizando su ID.\n\n## M칠todo HTTP\n\n`GET`\n\n## URL del Endpoint\n\n`{{base_url}}/api/animales/1`\n\n## Formato del Cuerpo de la Solicitud\n\nNo se requiere un cuerpo de solicitud para este m칠todo.\n\n## Par치metros Necesarios\n\n- **ID**: El identificador 칰nico del animal que se desea consultar. En este caso, el ID es `1`.\n    \n\n## Ejemplo de Solicitud\n\n``` json\nGET {{base_url}}/api/animales/1\n\n ```\n\n## Ejemplo de Respuesta\n\n``` json\n{\n  \"id\": 0,\n  \"nombre\": \"\",\n  \"fechaIngreso\": \"\",\n  \"especieName\": \"\",\n  \"comentarios\": []\n}\n\n ```\n\n### Descripci칩n de la Respuesta\n\n- **id**: El identificador del animal.\n    \n- **nombre**: El nombre del animal.\n    \n- **fechaIngreso**: La fecha en que el animal fue ingresado.\n    \n- **especieName**: El nombre de la especie del animal.\n    \n- **comentarios**: Una lista de comentarios relacionados con el animal.\n    \n\n## Notas Relevantes sobre Seguridad\n\n- Authorization: Bearer\n    \n- Aseg칰rese de que el token est칠 vigente y tenga los permisos necesarios para acceder a la informaci칩n del animal.\n    \n\nEsta documentaci칩n est치 dise침ada para facilitar el uso del API a desarrolladores hispanohablantes, asegurando que comprendan c칩mo interactuar con el endpoint de manera efectiva."
					},
					"response": []
				},
				{
					"name": "All Animales",
					"request": {
						"auth": {
							"type": "bearer",
							"bearer": [
								{
									"key": "token",
									"value": "{{token}}",
									"type": "string"
								}
							]
						},
						"method": "GET",
						"header": [],
						"url": {
							"raw": "{{base_url}}/api/animales",
							"host": [
								"{{base_url}}"
							],
							"path": [
								"api",
								"animales"
							]
						},
						"description": "# Documentaci칩n del Endpoint: Obtener Animales\n\nEste endpoint permite obtener una lista de animales registrados en el sistema.\n\n## M칠todo HTTP\n\n`GET`\n\n## URL\n\n`{{base_url}}/api/animales`\n\n## Formato del cuerpo de la solicitud\n\nEste endpoint no requiere un cuerpo de solicitud, ya que se utiliza el m칠todo GET para recuperar datos.\n\n## Par치metros necesarios\n\nNo se requieren par치metros en la solicitud.\n\n## Ejemplo de solicitud\n\n``` http\nGET {{base_url}}/api/animales\n\n ```\n\n## Ejemplo de respuesta\n\n``` json\n[\n    {\n        \"id\": 0,\n        \"nombre\": \"\",\n        \"fechaIngreso\": \"\",\n        \"especieName\": \"\",\n        \"comentarios\": []\n    }\n]\n\n ```\n\n## Notas relevantes sobre seguridad\n\n- Aseg칰rese de manejar el token JWT adecuadamente, ya que este endpoint puede requerir autenticaci칩n para acceder a los datos.\n    \n- Se recomienda utilizar HTTPS para proteger la informaci칩n durante la transmisi칩n."
					},
					"response": []
				},
				{
					"name": "Animal",
					"request": {
						"auth": {
							"type": "bearer",
							"bearer": [
								{
									"key": "token",
									"value": "{{token}}",
									"type": "string"
								}
							]
						},
						"method": "POST",
						"header": [],
						"body": {
							"mode": "raw",
							"raw": "{\r\n  \"nombre\": \"Magar\",\r\n  \"especieName\": \"oso pardo\"\r\n}",
							"options": {
								"raw": {
									"language": "json"
								}
							}
						},
						"url": {
							"raw": "{{base_url}}/api/animales",
							"host": [
								"{{base_url}}"
							],
							"path": [
								"api",
								"animales"
							]
						},
						"description": "# Documentaci칩n del Endpoint: Agregar Animales\n\n## M칠todo HTTP\n\n**POST**\n\n## URL\n\n`{{base_url}}/api/animales`\n\n## Formato del Cuerpo de la Solicitud\n\nEl cuerpo de la solicitud debe estar en formato **JSON**.\n\n## Par치metros Necesarios\n\n- `nombre` (string): El nombre del animal que se desea agregar.\n    \n- `especieName` (string): El nombre de la especie del animal.\n    \n\n## Ejemplo de Solicitud\n\n``` json\n{\n  \"nombre\": \"Magar\",\n  \"especieName\": \"oso pardo\"\n}\n\n ```\n\n## Ejemplo de Respuesta\n\n### Respuesta Exitosa (201 Created)\n\n``` json\n{\n    \"Mensaje\": \"Animal creado correctamente.\"\n}\n\n ```\n\n## Notas Relevantes sobre Seguridad\n\n- Se requiere un **token JWT** para autenticar la solicitud. Aseg칰rese de incluir el token en los encabezados de la solicitud.\n    \n- Revise las pol칤ticas de acceso y autorizaci칩n para garantizar que solo los usuarios autorizados puedan agregar animales."
					},
					"response": []
				},
				{
					"name": "Animal",
					"request": {
						"auth": {
							"type": "bearer",
							"bearer": [
								{
									"key": "token",
									"value": "{{token}}",
									"type": "string"
								}
							]
						},
						"method": "PUT",
						"header": [],
						"body": {
							"mode": "raw",
							"raw": "{\r\n  \"nombre\": \"Magarolu\",\r\n  \"especieName\": \"oso pardo\"\r\n}",
							"options": {
								"raw": {
									"language": "json"
								}
							}
						},
						"url": {
							"raw": "{{base_url}}/api/animales/6",
							"host": [
								"{{base_url}}"
							],
							"path": [
								"api",
								"animales",
								"6"
							]
						},
						"description": "# Documentaci칩n del Endpoint\n\n## M칠todo HTTP\n\n`PUT`\n\n## URL\n\n`{{base_url}}/api/animales/6`\n\n## Formato del cuerpo de la solicitud\n\nEl cuerpo de la solicitud debe estar en formato JSON y debe incluir los siguientes par치metros:\n\n``` json\n{\n  \"nombre\": \"string\",        // Nombre del animal (ejemplo: \"Magarolu\")\n  \"especieName\": \"string\"   // Nombre de la especie (ejemplo: \"oso pardo\")\n}\n\n ```\n\n## Par치metros necesarios\n\n- **nombre**: (string) El nombre del animal que se est치 actualizando.\n    \n- **especieName**: (string) El nombre de la especie del animal que se est치 actualizando.\n    \n\n## Ejemplos de solicitud\n\n``` json\n{\n  \"nombre\": \"Magarolu\",\n  \"especieName\": \"oso pardo\"\n}\n\n ```\n\n## Ejemplos de respuesta\n\n### Respuesta exitosa\n\n``` json\n{\n  \"Mensaje\": \"Animal actualizado correctamente.\"\n}\n\n ```\n\n## Notas relevantes sobre seguridad y manejo del token JWT\n\nAseg칰rese de incluir un token JWT v치lido en el encabezado de la solicitud para autenticar la operaci칩n.\n\nEs importante manejar el token de manera segura y no exponerlo en el cliente o en registros de acceso. Revise la documentaci칩n de seguridad de su API para obtener m치s detalles sobre c칩mo gestionar y proteger el token JWT."
					},
					"response": []
				},
				{
					"name": "By Id",
					"request": {
						"auth": {
							"type": "bearer",
							"bearer": [
								{
									"key": "token",
									"value": "{{token}}",
									"type": "string"
								}
							]
						},
						"method": "DELETE",
						"header": [],
						"url": {
							"raw": "{{base_url}}/api/animales/5",
							"host": [
								"{{base_url}}"
							],
							"path": [
								"api",
								"animales",
								"5"
							]
						},
						"description": "# Documentaci칩n del Endpoint\n\n## Descripci칩n\n\nEste endpoint permite eliminar un recurso espec칤fico en la colecci칩n de animales utilizando su identificador 칰nico.\n\n## M칠todo HTTP\n\n**DELETE**\n\n## URL\n\n`{{base_url}}/api/animales/{id}`\n\n## Formato del cuerpo de la solicitud\n\nNo se requiere un cuerpo de solicitud para esta operaci칩n. La eliminaci칩n se realiza mediante el identificador del recurso en la URL.\n\n## Par치metros necesarios\n\n- `id` (path parameter): El identificador 칰nico del animal que se desea eliminar. En este caso, el valor de `id` es `5`.\n    \n\n## Ejemplo de solicitud\n\n``` http\nDELETE {{base_url}}/api/animales/5\n\n ```\n\n## Ejemplo de respuesta\n\n``` json\n{\n  \"Mensaje\": \"Animal eliminado correctamente.\"\n}\n\n ```\n\n**Status:** 200\n\n## Notas relevantes sobre seguridad\n\n- Se recomienda incluir un token JWT en los encabezados de la solicitud para autenticar al usuario que realiza la eliminaci칩n. Aseg칰rese de que el token sea v치lido y tenga los permisos necesarios para realizar esta operaci칩n.\n    \n- Revise las pol칤ticas de seguridad de su aplicaci칩n para evitar la eliminaci칩n no autorizada de recursos."
					},
					"response": []
				}
			]
		},
		{
			"name": "Usuario",
			"item": [
				{
					"name": "All Usuarios",
					"request": {
						"auth": {
							"type": "bearer",
							"bearer": [
								{
									"key": "token",
									"value": "{{token}}",
									"type": "string"
								}
							]
						},
						"method": "GET",
						"header": [],
						"url": {
							"raw": "{{base_url}}/api/usuarios",
							"host": [
								"{{base_url}}"
							],
							"path": [
								"api",
								"usuarios"
							]
						},
						"description": "# Documentaci칩n del Endpoint: Obtener Usuarios\n\nEste endpoint permite recuperar una lista de usuarios registrados en el sistema.\n\n## M칠todo HTTP\n\n**GET**\n\n## URL\n\n`{{base_url}}/api/usuarios`\n\n## Formato del cuerpo de la solicitud\n\nNo se requiere cuerpo en la solicitud para este endpoint.\n\n## Par치metros necesarios\n\nNo se requieren par치metros en la solicitud.\n\n## Ejemplo de solicitud\n\n``` http\nGET {{base_url}}/api/usuarios\n\n ```\n\n## Ejemplo de respuesta\n\n### Respuesta exitosa\n\n``` json\n[\n    {\n        \"id\": 0,\n        \"nombre\": \"\",\n        \"email\": \"\",\n        \"roleName\": \"\"\n    }\n]\n\n ```\n\n### Respuesta de error\n\n``` json\n{\n    \"error\": \"No autorizado\"\n}\n\n ```\n\n## Notas relevantes sobre seguridad\n\n- Authorization: Bearer\n    \n- Es importante validar el token en el servidor para garantizar que solo los usuarios autenticados puedan acceder a esta informaci칩n."
					},
					"response": []
				},
				{
					"name": "Usuario",
					"request": {
						"auth": {
							"type": "bearer",
							"bearer": [
								{
									"key": "token",
									"value": "{{token}}",
									"type": "string"
								}
							]
						},
						"method": "POST",
						"header": [],
						"body": {
							"mode": "raw",
							"raw": "{\r\n  \"nombre\": \"juan\",\r\n  \"email\": \"juan@gmail.com\",\r\n  \"password\": \"string\"\r\n}",
							"options": {
								"raw": {
									"language": "json"
								}
							}
						},
						"url": {
							"raw": "{{base_url}}/api/usuarios",
							"host": [
								"{{base_url}}"
							],
							"path": [
								"api",
								"usuarios"
							]
						},
						"description": "## Endpoint: Crear Usuario\n\nEste endpoint permite registrar un nuevo usuario en el sistema. Se debe enviar un cuerpo en formato JSON con los datos necesarios para crear la cuenta. Tras una creaci칩n exitosa, el servidor responder치 con un mensaje de confirmaci칩n.\n\n### M칠todo HTTP\n\n`POST`\n\n### URL de Solicitud\n\n`{{base_url}}/api/usuarios`\n\n### Cuerpo de la Solicitud\n\nEl cuerpo debe enviarse en formato JSON e incluir los siguientes campos obligatorios:\n\n- **nombre** (string): El nombre del nuevo usuario.\n    \n- **email** (string): El correo electr칩nico del usuario. Debe ser una direcci칩n v치lida.\n    \n- **password** (string): La contrase침a del usuario.\n    \n\n#### Ejemplo de Cuerpo de Solicitud\n\n``` json\n{\n  \"nombre\": \"juan\",\n  \"email\": \"juan@gmail.com\",\n  \"password\": \"string\"\n}\n\n ```\n\n### Respuesta\n\nLa respuesta ser치 en formato JSON e incluir치 un mensaje confirmando la creaci칩n del usuario.\n\n#### Ejemplo de Respuesta Exitosa\n\n``` json\n{\n  \"Mensaje\": \"Usuario empleado creado correctamente.\"\n}\n\n ```\n\n### Notas\n\n- Aseg칰rate de que el correo electr칩nico no est칠 ya registrado en el sistema, ya que esto podr칤a causar un error de duplicaci칩n."
					},
					"response": []
				}
			]
		},
		{
			"name": "Comentario",
			"item": [
				{
					"name": "Muro de comentarios por Animal",
					"request": {
						"auth": {
							"type": "bearer",
							"bearer": [
								{
									"key": "token",
									"value": "{{token}}",
									"type": "string"
								}
							]
						},
						"method": "GET",
						"header": [],
						"url": {
							"raw": "{{base_url}}/api/comentarios/muro/hako",
							"host": [
								"{{base_url}}"
							],
							"path": [
								"api",
								"comentarios",
								"muro",
								"hako"
							]
						},
						"description": "## Endpoint: Obtener Comentarios del Muro de un Animal\n\nEste endpoint permite obtener todos los comentarios p칰blicos del muro de un animal espec칤fico, junto con sus respuestas organizadas jer치rquicamente.\n\n### M칠todo HTTP\n\n`GET`\n\n### URL de Solicitud\n\n`{{base_url}}/api/comentarios/muro/hako`\n\n> \n\n**Nota:** En este ejemplo, `\"hako\"` es el identificador del animal para el cual se est치n solicitando los comentarios. Puede variar seg칰n el nombre o ID del animal.\n\n \n  \n\n### Cuerpo de la Solicitud\n\nNo se requiere enviar cuerpo (`body`) en esta solicitud.\n\n### Respuesta\n\nLa respuesta ser치 un arreglo en formato JSON, donde cada elemento representa un comentario con la siguiente informaci칩n:\n\n- **id** (entero): Identificador 칰nico del comentario.\n    \n- **contenido** (cadena): Texto del comentario publicado.\n    \n- **fecha** (cadena, formato ISO 8601): Fecha y hora en que fue creado el comentario.\n    \n- **autorNombre** (cadena): Nombre del autor del comentario.\n    \n- **respuestas** (array): Lista de respuestas anidadas al comentario. Cada respuesta tiene la misma estructura.\n    \n\n#### Ejemplo de Respuesta Exitosa\n\n``` json\n[\n  {\n    \"id\": 1,\n    \"contenido\": \"Adoro\",\n    \"fecha\": \"2025-06-04T15:08:21.492430\",\n    \"autorNombre\": \"Admin\",\n    \"respuestas\": []\n  },\n  {\n    \"id\": 2,\n    \"contenido\": \"Que tierno\",\n    \"fecha\": \"2025-06-04T15:08:43.070411\",\n    \"autorNombre\": \"canelo\",\n    \"respuestas\": [\n      {\n        \"id\": 3,\n        \"contenido\": \"Siiiiiiiii\",\n        \"fecha\": \"2025-06-04T15:09:02.685328\",\n        \"autorNombre\": \"Admin\",\n        \"respuestas\": []\n      },\n      {\n        \"id\": 5,\n        \"contenido\": \"Me encanta Hako\",\n        \"fecha\": \"2025-06-04T21:01:53.298278\",\n        \"autorNombre\": \"Admin\",\n        \"respuestas\": []\n      }\n    ]\n  }\n]\n\n ```\n\n### Notas\n\n- Este endpoint **no requiere cuerpo de solicitud**.\n    \n- Los comentarios pueden tener m칰ltiples niveles de respuestas, aunque normalmente se espera una o dos capas de anidaci칩n."
					},
					"response": []
				},
				{
					"name": "Comentario",
					"request": {
						"auth": {
							"type": "bearer",
							"bearer": [
								{
									"key": "token",
									"value": "{{token}}",
									"type": "string"
								}
							]
						},
						"method": "POST",
						"header": [],
						"body": {
							"mode": "raw",
							"raw": "{\r\n  \"contenido\": \"Enamorada de Hako\",\r\n  \"animalNombre\": \"hako\",\r\n  \"padreId\": 2\r\n}",
							"options": {
								"raw": {
									"language": "json"
								}
							}
						},
						"url": {
							"raw": "{{base_url}}/api/comentarios",
							"host": [
								"{{base_url}}"
							],
							"path": [
								"api",
								"comentarios"
							]
						},
						"description": "## Endpoint: Crear Comentario en el Muro de un Animal\n\nEste endpoint permite publicar un nuevo comentario en el muro de un animal espec칤fico. Tambi칠n permite agregar una respuesta a un comentario existente utilizando el campo `padreId`.\n\n### M칠todo HTTP\n\n`POST`\n\n### URL de Solicitud\n\n`{{base_url}}/api/comentarios`\n\n### Cuerpo de la Solicitud\n\nEl cuerpo debe enviarse en formato JSON e incluir los siguientes campos:\n\n- **contenido** (string): Texto del comentario que se desea publicar.\n    \n- **animalNombre** (string): Nombre del animal al que se le desea agregar el comentario.\n    \n- **padreId** (entero, opcional): ID del comentario al que se est치 respondiendo. Si no se desea responder a otro comentario, este campo puede omitirse o establecerse como `null`.\n    \n\n#### Ejemplo de Cuerpo de Solicitud\n\n``` json\n{\n  \"contenido\": \"Enamorada de Hako\",\n  \"animalNombre\": \"hako\",\n  \"padreId\": 2\n}\n\n ```\n\nEn este ejemplo, se est치 agregando una respuesta al comentario con ID `2` en el muro del animal llamado \"hako\".\n\n### Respuesta\n\nLa respuesta ser치 en formato JSON e incluir치 un mensaje que indica que el comentario fue agregado exitosamente.\n\n#### Ejemplo de Respuesta Exitosa\n\n``` json\n{\n  \"Mensaje\": \"Comentario agregado correctamente.\"\n}\n\n ```\n\n### Notas\n\n- El campo `padreId` permite construir hilos de conversaci칩n (comentarios y respuestas). Si se omite usando `null`, el comentario se considera principal (no es respuesta)."
					},
					"response": []
				}
			]
		},
		{
			"name": "Indicadores",
			"item": [
				{
					"name": "Cantidad animales por zona",
					"request": {
						"auth": {
							"type": "bearer",
							"bearer": [
								{
									"key": "token",
									"value": "{{token}}",
									"type": "string"
								}
							]
						},
						"method": "GET",
						"header": [],
						"url": {
							"raw": "{{base_url}}/api/zonas/indicador/cantidadAnimalesPorZona",
							"host": [
								"{{base_url}}"
							],
							"path": [
								"api",
								"zonas",
								"indicador",
								"cantidadAnimalesPorZona"
							]
						},
						"description": "## Endpoint: Obtener Cantidad de Animales por Zona\n\nEste endpoint permite consultar un resumen estad칤stico que muestra cu치ntos animales hay registrados en cada zona del sistema.\n\n### M칠todo HTTP\n\n`GET`\n\n### URL de Solicitud\n\n`{{base_url}}/api/zonas/indicador/cantidadAnimalesPorZona`\n\n### Cuerpo de la Solicitud\n\nEste endpoint **no requiere cuerpo** (`body`). La solicitud se realiza directamente mediante el m칠todo `GET`.\n\n### Respuesta\n\nLa respuesta ser치 un arreglo en formato JSON, donde cada objeto representa una zona junto con la cantidad total de animales registrados en ella.\n\n#### Campos de la Respuesta\n\n- **nombreZona** (string): Nombre de la zona.\n    \n- **cantidadAnimales** (entero): N칰mero total de animales registrados en esa zona.\n    \n\n#### Ejemplo de Respuesta Exitosa\n\n``` json\n[\n  {\n    \"nombreZona\": \"Zona de osos\",\n    \"cantidadAnimales\": 3\n  },\n  {\n    \"nombreZona\": \"Zona de panteras\",\n    \"cantidadAnimales\": 0\n  },\n  {\n    \"nombreZona\": \"Zona de aves / aviario\",\n    \"cantidadAnimales\": 1\n  }\n]\n\n ```\n\n### Notas\n\n- Este endpoint es 칰til para mostrar estad칤sticas o indicadores visuales (por ejemplo, gr치ficos o reportes).\n    \n- cssCopiarEditarAuthorization: Bearer {tu_token_jwt}\n    \n- Una zona puede mostrar `cantidadAnimales = 0` si no hay animales asignados actualmente."
					},
					"response": []
				},
				{
					"name": "Porcentaje comentarios con respuesta",
					"request": {
						"auth": {
							"type": "bearer",
							"bearer": [
								{
									"key": "token",
									"value": "{{token}}",
									"type": "string"
								}
							]
						},
						"method": "GET",
						"header": [],
						"url": {
							"raw": "{{base_url}}/api/comentarios/indicador/porcentajeComentariosConRespuesta",
							"host": [
								"{{base_url}}"
							],
							"path": [
								"api",
								"comentarios",
								"indicador",
								"porcentajeComentariosConRespuesta"
							]
						},
						"description": "## Endpoint%3A%20Obtener%20Porcentaje%20de%20Comentarios%20con%20Respuesta\n\nEste%20endpoint%20proporciona%20un%20indicador%20en%20forma%20de%20porcentaje%20que%20muestra%20cu%C3%A1ntos%20comentarios%20tienen%20al%20menos%20una%20respuesta%2C%20en%20relaci%C3%B3n%20con%20el%20total%20de%20comentarios%20registrados.\n\n### M%C3%A9todo%20HTTP\n\n%3Ccode%20%3EGET%3C%2Fcode%3E\n\n### URL%20de%20Solicitud\n\n%3Ccode%20%3E%7B%7Bbase_url%7D%7D%2Fapi%2Fcomentarios%2Findicador%2FporcentajeComentariosConRespuesta%3C%2Fcode%3E\n\n### Cuerpo%20de%20la%20Solicitud\n\nEste%20endpoint%20%3Cstrong%20%3Eno%20requiere%20cuerpo%3C%2Fstrong%3E%20(%3Ccode%20%3Ebody%3C%2Fcode%3E).%20La%20informaci%C3%B3n%20se%20obtiene%20%C3%BAnicamente%20con%20una%20solicitud%20%3Ccode%20%3EGET%3C%2Fcode%3E.\n\n### Respuesta\n\nLa%20respuesta%20es%20un%20objeto%20JSON%20que%20contiene%20el%20porcentaje%20de%20comentarios%20que%20han%20recibido%20al%20menos%20una%20respuesta.\n\n#### Campos%20de%20la%20Respuesta\n\n%3Cli%20%3E%3Cdiv%3E%3Cstrong%20%3Eporcentaje%3C%2Fstrong%3E%20(string)%3A%20Porcentaje%20de%20comentarios%20con%20al%20menos%20una%20respuesta.%20El%20valor%20se%20presenta%20como%20texto%20e%20incluye%20el%20s%C3%ADmbolo%20de%20porcentaje%20(%3Ccode%20%3E%25%3C%2Fcode%3E).%3C%2Fdiv%3E%3C%2Fli%3E\n\n#### Ejemplo%20de%20Respuesta%20Exitosa\n\n``` json\n%3Cdiv%3E%7B%0A%3C%2Fdiv%3E%3Cdiv%3E%20%20%22porcentaje%22%3A%20%2250%2C0%25%22%0A%3C%2Fdiv%3E%3Cdiv%3E%7D%0A%3C%2Fdiv%3E\n ```\n\n> &lt;p &gt;En este ejemplo, el 50% de los comentarios registrados tienen al menos una respuesta.&lt;/p&gt; \n  \n\n### Notas\n\n%3Cli%20%3E%3Cdiv%3EEste%20endpoint%20es%20%C3%BAtil%20para%20generar%20%3Cstrong%20%3Eindicadores%20visuales%3C%2Fstrong%3E%20(por%20ejemplo%2C%20gr%C3%A1ficas%20o%20tarjetas%20estad%C3%ADsticas)%20en%20paneles%20de%20administraci%C3%B3n%20o%20informes.%3C%2Fdiv%3E%3C%2Fli%3E%3Cli%20%3E%3Cdiv%3ESi%20no%20hay%20comentarios%20registrados%20en%20el%20sistema%2C%20el%20backend%20debe%20manejar%20correctamente%20esta%20situaci%C3%B3n%20(por%20ejemplo%2C%20devolviendo%20%3Ccode%20%3E%220%25%22%3C%2Fcode%3E%20o%20lanzando%20un%20mensaje%20informativo).%0A%0A%3C%2Fdiv%3E%3C%2Fli%3E"
					},
					"response": []
				},
				{
					"name": "Cantidad de animales por especie",
					"request": {
						"auth": {
							"type": "bearer",
							"bearer": [
								{
									"key": "token",
									"value": "{{token}}",
									"type": "string"
								}
							]
						},
						"method": "GET",
						"header": [],
						"url": {
							"raw": "{{base_url}}/api/especies/indicador/animalesPorEspecie",
							"host": [
								"{{base_url}}"
							],
							"path": [
								"api",
								"especies",
								"indicador",
								"animalesPorEspecie"
							]
						},
						"description": "## Endpoint: Obtener Cantidad de Animales por Especie\n\nEste endpoint permite obtener un resumen de cu치ntos animales est치n registrados por cada especie dentro del sistema. Es 칰til para fines estad칤sticos o de visualizaci칩n en paneles administrativos.\n\n### M칠todo HTTP\n\n`GET`\n\n### URL de Solicitud\n\n`{{base_url}}/api/especies/indicador/animalesPorEspecie`\n\n### Cuerpo de la Solicitud\n\nEste endpoint **no requiere cuerpo** (`body`). Toda la informaci칩n se obtiene directamente mediante una solicitud `GET`.\n\n### Par치metros\n\nNo se requieren par치metros de ruta ni de consulta.\n\n### Respuesta\n\nLa respuesta ser치 un arreglo en formato JSON, donde cada objeto representa una especie con su respectiva cantidad de animales.\n\n#### Campos de la Respuesta\n\n- **especie** (string): Nombre de la especie.\n    \n- **cantidadAnimales** (entero): N칰mero total de animales registrados para esa especie.\n    \n\n#### Ejemplo de Respuesta Exitosa\n\n``` json\n[\n  {\n    \"especie\": \"Guepardo amarillo\",\n    \"cantidadAnimales\": 0\n  },\n  {\n    \"especie\": \"paloma del sur\",\n    \"cantidadAnimales\": 1\n  },\n  {\n    \"especie\": \"oso pardo\",\n    \"cantidadAnimales\": 3\n  }\n]\n\n ```\n\n### Notas\n\n- Este endpoint es ideal para generar **indicadores visuales**, como gr치ficas de barras o tortas, en dashboards administrativos.\n    \n- Una especie puede tener `cantidadAnimales = 0` si a칰n no se han registrado animales bajo esa clasificaci칩n."
					},
					"response": []
				},
				{
					"name": "Animales registrados en una fecha especifica",
					"request": {
						"auth": {
							"type": "bearer",
							"bearer": [
								{
									"key": "token",
									"value": "{{token}}",
									"type": "string"
								}
							]
						},
						"method": "GET",
						"header": [],
						"url": {
							"raw": "{{base_url}}/api/animales/indicador/animalesRegistradosEnFecha?fecha=2025-06-04",
							"host": [
								"{{base_url}}"
							],
							"path": [
								"api",
								"animales",
								"indicador",
								"animalesRegistradosEnFecha"
							],
							"query": [
								{
									"key": "fecha",
									"value": "2025-06-04"
								}
							]
						},
						"description": "## Endpoint: Obtener Animales Registrados en una Fecha Espec칤fica\n\nEste endpoint permite consultar todos los animales que fueron registrados en una fecha determinada, incluyendo su nombre, especie y la zona en la que se encuentran ubicados.\n\n### M칠todo HTTP\n\n`GET`\n\n### URL de Solicitud\n\n{{base_url}}/api/animales/indicador/animalesRegistradosEnFecha?fecha=2025-06-04  \n  \n\n### Par치metros de Consulta\n\n- **fecha** (LocalDate): Fecha espec칤fica en formato `YYYY-MM-DD` (ejemplo: `2025-06-04`) para la cual se desea obtener la lista de animales registrados.\n    \n\nEste par치metro es obligatorio. Si no se proporciona o tiene un formato incorrecto, el servidor puede devolver un error `400 Bad Request`.\n\n### Cuerpo de la Solicitud\n\nEste endpoint **no requiere cuerpo** (`body`), ya que los datos se env칤an mediante par치metros de consulta (query string).\n\n### Respuesta\n\nLa respuesta ser치 un arreglo JSON, donde cada objeto representa un animal registrado en la fecha indicada.\n\n#### Campos de la Respuesta\n\n- **nombreAnimal** (string): Nombre del animal registrado.\n    \n- **especie** (string): Nombre de la especie a la que pertenece el animal.\n    \n- **zona** (string): Nombre de la zona del zool칩gico o h치bitat donde se encuentra el animal.\n    \n\n#### Ejemplo de Respuesta Exitosa\n\n``` json\n[\n  {\n    \"nombreAnimal\": \"Kei\",\n    \"especie\": \"paloma del sur\",\n    \"zona\": \"Zona de aves / aviario\"\n  },\n  {\n    \"nombreAnimal\": \"Hako\",\n    \"especie\": \"oso pardo\",\n    \"zona\": \"Zona de osos\"\n  },\n  {\n    \"nombreAnimal\": \"Delye\",\n    \"especie\": \"oso pardo\",\n    \"zona\": \"Zona de osos\"\n  },\n  {\n    \"nombreAnimal\": \"Magarolu\",\n    \"especie\": \"oso pardo\",\n    \"zona\": \"Zona de osos\"\n  }\n]\n\n ```\n\n### Notas\n\n- Este endpoint es 칰til para monitoreo diario, reportes autom치ticos o generaci칩n de estad칤sticas en tiempo real.\n    \n- El par치metro `fecha` debe respetar el formato `YYYY-MM-DD`. Por ejemplo: `2025-06-04.`\n    \n- Si no hay animales registrados en la fecha especificada, la respuesta ser치 un arreglo vac칤o (`[]`)."
					},
					"response": []
				},
				{
					"name": "Buscar coincidencia por palabra clave",
					"request": {
						"auth": {
							"type": "bearer",
							"bearer": [
								{
									"key": "token",
									"value": "{{token}}",
									"type": "string"
								}
							]
						},
						"method": "GET",
						"header": [],
						"url": {
							"raw": "{{base_url}}/api/busqueda?palabra=hako",
							"host": [
								"{{base_url}}"
							],
							"path": [
								"api",
								"busqueda"
							],
							"query": [
								{
									"key": "palabra",
									"value": "hako"
								}
							]
						},
						"description": "## Endpoint: B칰squeda de Informaci칩n por Palabra Clave\n\nEste endpoint permite realizar b칰squedas en el sistema utilizando una palabra clave, devolviendo resultados relacionados con animales, comentarios y respuestas asociados.\n\n### M칠todo HTTP\n\n`GET`\n\n### URL de Solicitud\n\n``` html\n{{base_url}}/api/busqueda?palabra={palabraClave}\n\n ```\n\n### Par치metros de Consulta\n\n- **palabra** (string, requerido): Palabra clave que se usar치 para realizar la b칰squeda en los diferentes registros del sistema.\n    \n\nEste par치metro es obligatorio. Si no se proporciona, el servidor puede devolver un error `400 Bad Request`.\n\n### Cuerpo de la Solicitud\n\nEste endpoint **no requiere cuerpo** (`body`).\n\n### Respuesta\n\nLa respuesta es un arreglo JSON con los resultados que coinciden con la palabra clave de b칰squeda. Cada resultado incluye informaci칩n detallada sobre el tipo de resultado y su contexto.\n\n#### Campos de la Respuesta\n\n- **tipoResultado** (string): Tipo de resultado encontrado. Puede ser:\n    \n    - `\"ANIMAL\"`: Resultado relacionado con un animal.\n        \n    - `\"RESPUESTA\"`: Resultado que corresponde a una respuesta en un comentario.\n        \n    - `\"Zona\", \"Especie\", \"Comentario\"..etc...`\n        \n- **zonaNombre** (string): Nombre de la zona donde se encuentra el animal.\n    \n- **especieNombre** (string): Nombre de la especie del animal.\n    \n- **animalNombre** (string): Nombre del animal.\n    \n- **comentarioContenido** (string|null): Contenido del comentario relacionado (si aplica).\n    \n- **respuestaContenido** (string|null): Contenido de la respuesta asociada (si aplica).\n    \n\n#### Ejemplo de Respuesta Exitosa\n\n``` json\n[\n  {\n    \"tipoResultado\": \"ANIMAL\",\n    \"zonaNombre\": \"Zona de osos\",\n    \"especieNombre\": \"oso pardo\",\n    \"animalNombre\": \"Hako\",\n    \"comentarioContenido\": null,\n    \"respuestaContenido\": null\n  },\n  {\n    \"tipoResultado\": \"RESPUESTA\",\n    \"zonaNombre\": \"Zona de osos\",\n    \"especieNombre\": \"oso pardo\",\n    \"animalNombre\": \"Hako\",\n    \"comentarioContenido\": \"Que tierno\",\n    \"respuestaContenido\": \"Me encanta Hako\"\n  },\n  {\n    \"tipoResultado\": \"RESPUESTA\",\n    \"zonaNombre\": \"Zona de osos\",\n    \"especieNombre\": \"oso pardo\",\n    \"animalNombre\": \"Hako\",\n    \"comentarioContenido\": \"Que tierno\",\n    \"respuestaContenido\": \"Enamorada de Hako\"\n  }\n]\n\n ```\n\n### Notas\n\n- La b칰squeda es sensible a la palabra clave proporcionada y puede devolver m칰ltiples tipos de resultados.\n    \n- El endpoint es 칰til para encontrar r치pidamente informaci칩n relacionada con un t칠rmino espec칤fico dentro de animales y comentarios.\n    \n- Se recomienda validar que el par치metro `palabra` no est칠 vac칤o antes de realizar la solicitud.\n    \n- Si no se encuentran resultados, la respuesta ser치 un `NoContent` arreglo vac칤o `[]`."
					},
					"response": []
				}
			]
		},
		{
			"name": "Login",
			"request": {
				"method": "POST",
				"header": [],
				"body": {
					"mode": "raw",
					"raw": "{\r\n  \"email\": \"admin@mail.com\",\r\n  \"password\": \"admin\"\r\n}",
					"options": {
						"raw": {
							"language": "json"
						}
					}
				},
				"url": {
					"raw": "{{base_url}}/v1/auth/login",
					"host": [
						"{{base_url}}"
					],
					"path": [
						"v1",
						"auth",
						"login"
					]
				},
				"description": "## Descripci칩n de la API: Inicio de sesi칩n\n\nEste endpoint permite a los usuarios autenticarse en el sistema. Al realizar una solicitud POST a `{{base_url}}/v1/auth/login`, se env칤an las credenciales del usuario para obtener un token JWT que se utilizar치 para la autenticaci칩n en futuras solicitudes.\n\n### Par치metros de Solicitud\n\nLa solicitud debe incluir un cuerpo en formato JSON con los siguientes par치metros:\n\n- **email** (string): La direcci칩n de correo electr칩nico del usuario que intenta iniciar sesi칩n.\n    \n- **password** (string): La contrase침a correspondiente a la direcci칩n de correo electr칩nico proporcionada.\n    \n\n### Ejemplo de Cuerpo de Solicitud\n\n``` json\n{\n  \"email\": \"admin@mail.com\",\n  \"password\": \"admin\"\n}\n\n ```\n\n### Formato de Respuesta Esperado\n\nSi la autenticaci칩n es exitosa, el servidor devolver치 un c칩digo de estado `200` con el siguiente cuerpo en formato JSON:\n\n``` json\n{\n  \"jwtToken\": \"\",\n  \"email\": \"\",\n  \"roles\": [\"\"]\n}\n\n ```\n\n- **jwtToken** (string): El token JWT que se utilizar치 para la autenticaci칩n en solicitudes posteriores.\n    \n- **email** (string): La direcci칩n de correo electr칩nico del usuario autenticado.\n    \n- **roles** (array): Una lista de roles asociados al usuario.\n    \n\n### Notas Adicionales\n\n- Aseg칰rese de que las credenciales proporcionadas sean correctas para evitar errores de autenticaci칩n.\n    \n- El token JWT debe ser almacenado de manera segura y se debe enviar en el encabezado de autorizaci칩n en las solicitudes posteriores al servidor."
			},
			"response": []
		}
	],
	"event": [
		{
			"listen": "prerequest",
			"script": {
				"type": "text/javascript",
				"packages": {},
				"exec": [
					""
				]
			}
		},
		{
			"listen": "test",
			"script": {
				"type": "text/javascript",
				"packages": {},
				"exec": [
					""
				]
			}
		}
	],
	"variable": [
		{
			"key": "base_url",
			"value": "http://localhost:8091",
			"type": "default"
		},
		{
			"key": "token",
			"value": "",
			"type": "default"
		},
		{
			"key": "token_empleado",
			"value": "",
			"type": "default"
		}
	]
}